{"apiVersion":"kodama/v1alpha1","kind":"Pipeline","metadata":{"name":"implement-and-review"},"spec":{"inputs":{},"steps":[{"agent":{"profile":"coding-v1"},"id":"implement","kind":"agent","needs":[],"outputs":{},"retry":{"backoffSeconds":0,"maxAttempts":1,"on":[]},"timeoutSeconds":1800,"workspace":{"access":"write","from":"run"}},{"args":["go test ./..."],"command":["/bin/sh","-ec"],"env":{},"id":"test","image":"registry.example.invalid/go-tools@sha256:1111111111111111111111111111111111111111111111111111111111111111","kind":"container","needs":["implement"],"outputs":{"report":{"path":"/kodama/outputs/tests.json","type":"artifact"}},"retry":{"backoffSeconds":0,"maxAttempts":1,"on":[]},"secretFiles":{},"timeoutSeconds":600,"workspace":{"access":"read","from":"implement"}},{"gate":{"evidence":["${{ steps.test.outputs.report }}"]},"id":"review","kind":"gate","needs":["test"]}]}}