{"apiVersion":"kodama/v1alpha1","kind":"Pipeline","metadata":{"name":"build-and-publish"},"spec":{"inputs":{"attempts":{"default":9007199254740991,"required":false,"type":"integer"},"channel":{"default":"stable","required":false,"type":"string"},"publish":{"default":false,"required":false,"type":"boolean"},"screenshot":{"required":false,"type":"artifact"}},"steps":[{"args":["gofmt -w .\ngit add -A\n"],"command":["/bin/sh","-ec"],"env":{},"id":"format","image":"registry.example.invalid/go-tools@sha256:1111111111111111111111111111111111111111111111111111111111111111","kind":"container","needs":[],"outputs":{},"retry":{"backoffSeconds":0,"maxAttempts":1,"on":[]},"secretFiles":{},"timeoutSeconds":300,"workspace":{"access":"write","from":"run"}},{"args":["echo ${CHANNEL}"],"command":["/bin/sh","-ec"],"env":{"CHANNEL":"${{ inputs.channel }}","RETRIES":3,"SOURCE":"${{ steps.format.outputs.commit }}","STRICT":true},"id":"test","image":"registry.example.invalid/go-tools@sha256:1111111111111111111111111111111111111111111111111111111111111111","kind":"container","needs":["format"],"outputs":{"coverage":{"type":"integer"},"report":{"path":"/kodama/outputs/tests.json","type":"artifact"}},"retry":{"backoffSeconds":30,"maxAttempts":3,"on":["infrastructure","transient"]},"secretFiles":{},"timeoutSeconds":600,"workspace":{"access":"read","from":"format"}},{"args":[],"command":["/kodama/bin/build-image"],"env":{"REGISTRY_TOKEN":{"secretRef":"secret://project/registry-token"}},"id":"image","image":"registry.example.invalid/builder@sha256:2222222222222222222222222222222222222222222222222222222222222222","kind":"container","needs":["test"],"outputs":{"image":{"type":"ociArtifact"}},"retry":{"backoffSeconds":0,"maxAttempts":1,"on":[]},"secretFiles":{"netrc":"secret://project/netrc"},"timeoutSeconds":1200,"when":{"equals":true,"input":"publish"},"workspace":{"access":"read","from":"format"}}]}}