{"apiVersion":"kodama/v1alpha1","kind":"Pipeline","metadata":{"name":"test"},"spec":{"inputs":{},"steps":[{"args":["cd /workspace && go test -json ./... > /kodama/outputs/tests.json"],"command":["/bin/sh","-ec"],"env":{},"id":"test","image":"registry.example.invalid/go-tools@sha256:1111111111111111111111111111111111111111111111111111111111111111","kind":"container","needs":[],"outputs":{"report":{"path":"/kodama/outputs/tests.json","type":"artifact"}},"retry":{"backoffSeconds":0,"maxAttempts":1,"on":[]},"secretFiles":{},"timeoutSeconds":600,"workspace":{"access":"read","from":"run"}}]}}